Title,Photo_Source,Photo_Orientation,Skills,File_URL
Olympic Medals Dashboard,OlympicMedals.png,vertical,"Tableau, data viz",OlympicMedals
Superstore Product Analysis Dashboard,SuperstoreProduct.png,horizontal,skill1,SuperstoreProduct
Fremont Bridge Usage Dashboard,FremontBridge.png,horizontal,skill2,FremontBridge
NYC Airbnb Rentals Dashboard,NYCAirbnb.png,horizontal,skill3,NYCAirbnb
Superstore Customer Lookup Dashboard,SuperstoreCustomer.png,horizontal,skill4,SuperstoreCustomer
Does it Rain More in Seattle,RainSeattle.png,horizontal,skill5,RainSeattle
FAA Wildlife Strikes Dashboard,WildLifeStrikes.png,vertical,skill6,WildlifeStrikes