Title,Photo_Source,Photo_Orientation,Skills,File_URL
Olympic Medals Dashboard,OlympicMedals.png,vertical,"Tableau, data viz",OlympicMedals
Superstore Product Analysis Dashboard,SuperstoreProduct.png,horizontal,"Tableau, data viz",SuperstoreProduct
Fremont Bridge Usage Dashboard,FremontBridge.png,horizontal,"Tableau, data viz",FremontBridge
NYC Airbnb Rentals Dashboard,NYCAirbnb.png,horizontal,"Tableau, data viz",NYCAirbnb
Superstore Customer Lookup Dashboard,SuperstoreCustomer.png,horizontal,"Tableau, data viz",SuperstoreCustomer
Does it Rain More in Seattle? ,RainSeattle.png,horizontal,"Tableau, data viz",RainSeattle
FAA Wildlife Strikes Dashboard,WildLifeStrikes.png,vertical,"Tableau, data viz",WildlifeStrikes